{"$defs":{"CompatibilityRange":{"additionalProperties":false,"properties":{"maximum_druff_contract":{"title":"Maximum Druff Contract","type":"string"},"minimum_druff_contract":{"title":"Minimum Druff Contract","type":"string"}},"required":["minimum_druff_contract","maximum_druff_contract"],"title":"CompatibilityRange","type":"object"},"ContractIdentity":{"additionalProperties":false,"properties":{"id":{"const":"io.dander.control.contracts/v1","title":"Id","type":"string"},"sha256":{"pattern":"^[0-9a-f]{64}$","title":"Sha256","type":"string"}},"required":["id","sha256"],"title":"ContractIdentity","type":"object"}},"$id":"urn:dander:control:contracts:v1:control-bootstrap","$schema":"https://json-schema.org/draft/2020-12/schema","additionalProperties":false,"description":"Secret-free discovery data for one hosted Druff deployment.","properties":{"api_audience":{"title":"Api Audience","type":"string"},"api_url":{"title":"Api Url","type":"string"},"compatibility":{"$ref":"#/$defs/CompatibilityRange"},"contract":{"$ref":"#/$defs/ContractIdentity"},"issuer":{"title":"Issuer","type":"string"},"logout_uri":{"title":"Logout Uri","type":"string"},"public_client_id":{"title":"Public Client Id","type":"string"},"redirect_uri":{"title":"Redirect Uri","type":"string"},"schema_version":{"const":1,"default":1,"title":"Schema Version","type":"integer"}},"required":["api_url","issuer","public_client_id","api_audience","redirect_uri","logout_uri","contract","compatibility"],"title":"ControlBootstrapDescriptor","type":"object"}
