{"api_audience":"https://control.example.invalid/api","api_url":"https://control.example.invalid","compatibility":{"maximum_druff_contract":"1.x","minimum_druff_contract":"1.0.0"},"contract":{"id":"io.dander.control.contracts/v1","sha256":"0000000000000000000000000000000000000000000000000000000000000000"},"issuer":"https://identity.example.invalid","logout_uri":"https://druff.example.invalid/signed-out","public_client_id":"druff-public-client","redirect_uri":"https://druff.example.invalid/auth/callback","schema_version":1}
